序号,采购人,合同名称,分类,理由
10982,安徽财经大学,安徽财经大学数字资源、图书资料第16包,协调能力,高等教育资源
10983,无供应商,黎平县3万吨县级储备粮库建设项目规划设计采购专业建设工程设计合同,协调能力,粮食储备设施
10984,安徽省发展和改革委员会,安徽省资源枯竭型城市转型工作绩效评估报告编制,协调能力,区域发展规划
10985,合肥市行政学院,新教学基地数字化校园（一期）新增第一部分设备采购第1包,协调能力,干部培训设施
10986,宿州学院,宿州学院教学仪器设备采购第14包,协调能力,高等教育设施
10987,安徽财经大学,安徽财经大学数字资源、图书资料第17包,协调能力,高等教育资源
10988,合肥市重点工程建设管理局,张生圩排涝泵站改扩建工程监理,协调能力,水利防洪设施
10989,海关总署物资装备采购中心,绿盟远程安全评估系统采购合同,提取能力,海关信息安全
10990,国土资源部信息中心,中央单位批量集中采购简易合同,提取能力,国土资源信息化
10991,永靖县公安局,永靖县公安局台式电脑及打印机等办公设备采购项目供货合同,合规能力,公安机关设施
10992,甘肃省疾病预防控制中心,甘肃省疾病预防控制中心食品安全风险监测（离子色谱仪）采购项目购销合同,协调能力,疾控检测设施
10993,安徽省公安厅警察训练总队,安徽省公安厅警察训练总队视频监控设备,合规能力,公安训练设施
10994,甘肃林业职业技术学院,甘肃林业职业技术学院林业技术实训基地设备采购项目,协调能力,职业教育设施
10995,临夏州强制隔离戒毒所,临夏州强制隔离戒毒所冬季供暖及两灶用煤购销合同,合规能力,戒毒设施保障
10996,海关总署物资装备采购中心,中央国家机关政府采购网上竞价合同,提取能力,海关设施采购
10997,合肥市重点工程建设管理局,合肥滨湖新区珠江路等6条路工程监理、成都路等6条路工程监理第2包,协调能力,交通基础设施
10998,甘肃省人民检察院,全省检察机关服装项目政府采购合同,合规能力,检察机关保障
10999,合肥市重点工程建设管理局,合肥市重点工程建设管理局供电配套工程协审定点单位,协调能力,市政电力设施
